{
  "metadata_version": "1.1.0",
  "name": "normalized_sentinel_weekly_gender_2002_31",
  "filename": "normalized_sentinel_weekly_gender_2002_31.csv",
  "path": "processed/normalized_sentinel_weekly_gender_2002_31.csv",
  "profile": "tokyo-idsc-processed",
  "data_type": "sentinel_weekly_gender",
  "temporal": {
    "year": 2002,
    "period": 31,
    "period_type": "weekly"
  },
  "bytes": 1083,
  "lines": 25,
  "hash": {
    "algorithm": "sha256",
    "value": "252d951cb3aef2b1cb58d593d00f88c038737fbbbc71aee402b3646e0513b63c"
  },
  "encoding": "utf-8",
  "created": "2025-12-18T07:33:03.020248+00:00",
  "modified": "2025-12-18T07:33:03.020248+00:00",
  "sources": [
    {
      "title": "sentinel_weekly_gender_2002_31.csv",
      "path": "raw/sentinel_weekly_gender_2002_31.csv"
    }
  ],
  "_process": {
    "source_name": "sentinel_weekly_gender_2002_31",
    "source_hash": "7a180019ed22e4e751e1dcbdd6c5ee16bbe07374eeb053fe3fe5650c2d0741ff",
    "processing_time_seconds": 8.0108642578125e-05,
    "gender": null
  }
}