{
  "metadata_version": "1.1.0",
  "name": "normalized_sentinel_weekly_age_total_2014_14",
  "filename": "normalized_sentinel_weekly_age_total_2014_14.csv",
  "path": "processed/normalized_sentinel_weekly_age_total_2014_14.csv",
  "profile": "tokyo-idsc-processed",
  "data_type": "sentinel_weekly_age",
  "temporal": {
    "year": 2014,
    "period": 14,
    "period_type": "weekly"
  },
  "bytes": 3658,
  "lines": 22,
  "hash": {
    "algorithm": "sha256",
    "value": "779aaec7694b761fd94023edcccac9a7577d09f5c1d0299bca5e845fb9e8d10b"
  },
  "encoding": "utf-8",
  "created": "2025-12-18T07:33:01.130463+00:00",
  "modified": "2025-12-18T07:33:01.130463+00:00",
  "sources": [
    {
      "title": "sentinel_weekly_age_2014_14.csv",
      "path": "raw/sentinel_weekly_age_2014_14.csv"
    }
  ],
  "_process": {
    "source_name": "sentinel_weekly_age_2014_14",
    "source_hash": "f241199b0e56cee6129eb9fb480148d970de773f32ee9d82173e7c2eb19e5ae1",
    "processing_time_seconds": 0.0008716583251953125,
    "gender": "total"
  }
}