{
  "metadata_version": "1.1.0",
  "name": "normalized_sentinel_weekly_age_female_2004_51",
  "filename": "normalized_sentinel_weekly_age_female_2004_51.csv",
  "path": "processed/normalized_sentinel_weekly_age_female_2004_51.csv",
  "profile": "tokyo-idsc-processed",
  "data_type": "sentinel_weekly_age",
  "temporal": {
    "year": 2004,
    "period": 51,
    "period_type": "weekly"
  },
  "bytes": 2715,
  "lines": 22,
  "hash": {
    "algorithm": "sha256",
    "value": "c2e5a6c5aa021732e14cece5624156524a063c66d9e91421932e5c8e11aa21cb"
  },
  "encoding": "utf-8",
  "created": "2025-12-18T07:32:57.962945+00:00",
  "modified": "2025-12-18T07:32:57.962945+00:00",
  "sources": [
    {
      "title": "sentinel_weekly_age_2004_51.csv",
      "path": "raw/sentinel_weekly_age_2004_51.csv"
    }
  ],
  "_process": {
    "source_name": "sentinel_weekly_age_2004_51",
    "source_hash": "2c8bdc4819f9eb9d87b618b089f0656064ea29b872cef27eda28f9abf9ba5cfe",
    "processing_time_seconds": 0.0008523464202880859,
    "gender": "female"
  }
}