{
  "metadata_version": "1.3.0",
  "name": "sentinel_weekly_medical_district_2025_03",
  "filename": "sentinel_weekly_medical_district_2025_03.csv",
  "path": "sentinel_weekly_medical_district_2025_03.csv",
  "profile": "tokyo-idsc-raw",
  "data_type": "sentinel_weekly_medical_district",
  "temporal": {
    "year": 2025,
    "period": 3,
    "period_type": "weekly"
  },
  "bytes": 7475,
  "lines": 69,
  "hash": {
    "algorithm": "sha256",
    "value": "e17f4ecece2b08f664cd6866a5ef734d94ac6232248c4bbca8b2a1189ce685b6"
  },
  "encoding": "shift_jis",
  "created": "2025-12-17T02:57:48.396289+00:00",
  "modified": "2026-01-01T08:47:55.305121+00:00",
  "sources": [],
  "_fetch": {
    "source_url": null,
    "fetch_time_seconds": 0.7411019802093506,
    "force_overwrite": true,
    "save_all_zero": false
  },
  "verification": {
    "status": "verified",
    "verified_at": "2026-01-01T08:47:55.305506+00:00",
    "method": "automated",
    "checks": {
      "file_size": true,
      "encoding": true,
      "csv_format": true,
      "path_safety": true
    },
    "errors": [],
    "warnings": [
      "[csv_format] Inconsistent column count"
    ],
    "details": {
      "column_counts": [
        0,
        1,
        2,
        30
      ]
    }
  },
  "quality": {
    "validation_timestamp": "2026-01-01T08:47:55.305516+00:00",
    "validation_status": "completed",
    "issues": [
      {
        "check_type": "gender_sum_consistency",
        "validation_status": "completed",
        "message": "Observed mismatch between (male + female) and reported total in 14 record(s)",
        "details": {
          "source_file": "sentinel_weekly_medical_district_2025_03.csv",
          "affected_count": 14,
          "truncated": true,
          "affected_locations": [
            {
              "location": "区中央部",
              "column": "突発性発しん",
              "row_index": 3,
              "male": 1,
              "female": 1,
              "total": 1,
              "expected": 2
            },
            {
              "location": "区南部",
              "column": "手足口病",
              "row_index": 4,
              "male": 3,
              "female": 3,
              "total": 3,
              "expected": 6
            },
            {
              "location": "区西南部",
              "column": "咽頭結膜熱",
              "row_index": 5,
              "male": 2,
              "female": 2,
              "total": 2,
              "expected": 4
            },
            {
              "location": "区西部",
              "column": "突発性発しん",
              "row_index": 6,
              "male": 4,
              "female": 4,
              "total": 4,
              "expected": 8
            },
            {
              "location": "区西北部",
              "column": "手足口病",
              "row_index": 7,
              "male": 1,
              "female": 1,
              "total": 1,
              "expected": 2
            },
            {
              "location": "区東北部",
              "column": "ヘルパンギーナ",
              "row_index": 8,
              "male": 1,
              "female": 1,
              "total": 1,
              "expected": 2
            },
            {
              "location": "区東部",
              "column": "インフルエンザ入院",
              "row_index": 9,
              "male": 4,
              "female": 4,
              "total": 4,
              "expected": 8
            },
            {
              "location": "西多摩",
              "column": "突発性発しん",
              "row_index": 10,
              "male": 3,
              "female": 3,
              "total": 3,
              "expected": 6
            },
            {
              "location": "南多摩",
              "column": "不明発しん症",
              "row_index": 11,
              "male": 1,
              "female": 1,
              "total": 1,
              "expected": 2
            },
            {
              "location": "北多摩西部",
              "column": "咽頭結膜熱",
              "row_index": 12,
              "male": 1,
              "female": 1,
              "total": 1,
              "expected": 2
            }
          ]
        }
      }
    ]
  }
}