{
  "metadata_version": "1.3.0",
  "name": "sentinel_weekly_age_2005_31",
  "filename": "sentinel_weekly_age_2005_31.csv",
  "path": "raw/sentinel_weekly_age_2005_31.csv",
  "profile": "tokyo-idsc-raw",
  "data_type": "sentinel_weekly_age",
  "temporal": {
    "year": 2005,
    "period": 31,
    "period_type": "weekly"
  },
  "bytes": 8981,
  "lines": 99,
  "hash": {
    "algorithm": "sha256",
    "value": "f4570069e67efe52fe6e08b251e983098214953fe58555403e2060ae52f90910"
  },
  "encoding": "shift_jis",
  "created": "2025-11-01T16:08:52.448443",
  "modified": "2025-11-01T16:08:52.448443",
  "sources": [],
  "verification": {
    "status": "verified",
    "verified_at": "2025-12-17T09:53:50.680244",
    "method": "automated",
    "checks": {
      "file_size": true,
      "encoding": true,
      "csv_format": true,
      "path_safety": true
    },
    "errors": [],
    "warnings": [
      "[csv_format] Inconsistent column count"
    ],
    "details": {
      "column_counts": [
        0,
        1,
        2,
        24
      ]
    }
  },
  "_fetch": {
    "fetch_time_seconds": 0.6483910083770752,
    "force_overwrite": false,
    "save_all_zero": false
  },
  "quality": {
    "validation_timestamp": "2025-12-23T09:43:58.464376+00:00",
    "validation_status": "completed",
    "issues": []
  }
}