{
  "metadata_version": "1.1.0",
  "name": "normalized_sentinel_weekly_health_center_male_2011_34",
  "filename": "normalized_sentinel_weekly_health_center_male_2011_34.csv",
  "path": "processed/normalized_sentinel_weekly_health_center_male_2011_34.csv",
  "profile": "tokyo-idsc-processed",
  "data_type": "sentinel_weekly_health_center",
  "temporal": {
    "year": 2011,
    "period": 34,
    "period_type": "weekly"
  },
  "bytes": 4334,
  "lines": 33,
  "hash": {
    "algorithm": "sha256",
    "value": "8cd4e0e3977072ead37d41ffdbec2f1aa5b7132d16680d08bc43c67999ef145b"
  },
  "encoding": "utf-8",
  "created": "2025-12-18T07:33:03.273081+00:00",
  "modified": "2025-12-18T07:33:03.273081+00:00",
  "sources": [
    {
      "title": "sentinel_weekly_health_center_2011_34.csv",
      "path": "raw/sentinel_weekly_health_center_2011_34.csv"
    }
  ],
  "_process": {
    "source_name": "sentinel_weekly_health_center_2011_34",
    "source_hash": "5a01aff870db8a69e574f3a5c5225649de38f6a1c8f92771f7a18b879de10abd",
    "processing_time_seconds": 0.0010409355163574219,
    "gender": "male"
  }
}