{
  "metadata_version": "1.1.0",
  "name": "normalized_sentinel_weekly_health_center_female_2014_33",
  "filename": "normalized_sentinel_weekly_health_center_female_2014_33.csv",
  "path": "processed/normalized_sentinel_weekly_health_center_female_2014_33.csv",
  "profile": "tokyo-idsc-processed",
  "data_type": "sentinel_weekly_health_center",
  "temporal": {
    "year": 2014,
    "period": 33,
    "period_type": "weekly"
  },
  "bytes": 4477,
  "lines": 33,
  "hash": {
    "algorithm": "sha256",
    "value": "e9cb7fc61a384eef3caebddb993291d530fce131022f55a6ead0c59558fbd698"
  },
  "encoding": "utf-8",
  "created": "2025-12-18T07:32:59.663090+00:00",
  "modified": "2025-12-18T07:32:59.663090+00:00",
  "sources": [
    {
      "title": "sentinel_weekly_health_center_2014_33.csv",
      "path": "raw/sentinel_weekly_health_center_2014_33.csv"
    }
  ],
  "_process": {
    "source_name": "sentinel_weekly_health_center_2014_33",
    "source_hash": "373e47d25acbae4202e0020bd9259d0dad0d15671736b9a40e1895728cf53bae",
    "processing_time_seconds": 0.0009970664978027344,
    "gender": "female"
  }
}