{
  "metadata_version": "1.1.0",
  "name": "sentinel_weekly_medical_district_2013_05",
  "filename": "sentinel_weekly_medical_district_2013_05.csv",
  "path": "raw/sentinel_weekly_medical_district_2013_05.csv",
  "profile": "tokyo-idsc-raw",
  "data_type": "sentinel_weekly_medical_district",
  "temporal": {
    "year": 2013,
    "period": 5,
    "period_type": "weekly"
  },
  "bytes": 6879,
  "lines": 69,
  "hash": {
    "algorithm": "sha256",
    "value": "be46f85ec00b7e0dc2746440064b7e5bcf81b47774d0d1ca4c5bce1b926cce57"
  },
  "encoding": "shift_jis",
  "created": "2025-11-01T17:24:25.387015",
  "modified": "2025-11-01T17:24:25.387015",
  "sources": [],
  "verification": {
    "status": "verified",
    "verified_at": "2025-12-17T09:53:52.835143",
    "method": "automated",
    "checks": {
      "file_size": true,
      "encoding": true,
      "csv_format": true,
      "path_safety": true
    },
    "errors": [],
    "warnings": [
      "[csv_format] Inconsistent column count: {0, 1, 2, 28}"
    ]
  },
  "_fetch": {
    "fetch_time_seconds": 0.4944007396697998,
    "force_overwrite": false,
    "save_all_zero": false
  }
}