{
  "metadata_version": "1.3.0",
  "name": "sentinel_weekly_medical_district_2013_17",
  "filename": "sentinel_weekly_medical_district_2013_17.csv",
  "path": "raw/sentinel_weekly_medical_district_2013_17.csv",
  "profile": "tokyo-idsc-raw",
  "data_type": "sentinel_weekly_medical_district",
  "temporal": {
    "year": 2013,
    "period": 17,
    "period_type": "weekly"
  },
  "bytes": 6841,
  "lines": 69,
  "hash": {
    "algorithm": "sha256",
    "value": "4bcfdbdbfb995758da106a0738e4b2190a7d1f31d0edcbb0097bb150e20086d2"
  },
  "encoding": "shift_jis",
  "created": "2025-11-01T17:24:43.394319",
  "modified": "2025-11-01T17:24:43.394319",
  "sources": [],
  "verification": {
    "status": "verified",
    "verified_at": "2025-12-17T09:53:52.840460",
    "method": "automated",
    "checks": {
      "file_size": true,
      "encoding": true,
      "csv_format": true,
      "path_safety": true
    },
    "errors": [],
    "warnings": [
      "[csv_format] Inconsistent column count"
    ],
    "details": {
      "column_counts": [
        0,
        1,
        2,
        28
      ]
    }
  },
  "_fetch": {
    "fetch_time_seconds": 0.3595919609069824,
    "force_overwrite": false,
    "save_all_zero": false
  },
  "quality": {
    "validation_timestamp": "2025-12-23T09:43:56.594897+00:00",
    "validation_status": "completed",
    "issues": [
      {
        "check_type": "gender_sum_consistency",
        "validation_status": "completed",
        "message": "Observed mismatch between (male + female) and reported total in 13 record(s)",
        "details": {
          "source_file": "sentinel_weekly_medical_district_2013_17.csv",
          "affected_count": 13,
          "truncated": true,
          "affected_locations": [
            {
              "location": "区中央部",
              "column": "流行性耳下腺炎",
              "row_index": 3,
              "male": 1,
              "female": 1,
              "total": 1,
              "expected": 2
            },
            {
              "location": "区南部",
              "column": "手足口病",
              "row_index": 4,
              "male": 2,
              "female": 2,
              "total": 2,
              "expected": 4
            },
            {
              "location": "区西南部",
              "column": "ヘルパンギーナ",
              "row_index": 5,
              "male": 2,
              "female": 2,
              "total": 2,
              "expected": 4
            },
            {
              "location": "区西部",
              "column": "RSウイルス感染症",
              "row_index": 6,
              "male": 1,
              "female": 1,
              "total": 1,
              "expected": 2
            },
            {
              "location": "区西北部",
              "column": "RSウイルス感染症",
              "row_index": 7,
              "male": 1,
              "female": 1,
              "total": 1,
              "expected": 2
            },
            {
              "location": "区東北部",
              "column": "RSウイルス感染症",
              "row_index": 8,
              "male": 1,
              "female": 1,
              "total": 1,
              "expected": 2
            },
            {
              "location": "西多摩",
              "column": "伝染性紅斑",
              "row_index": 10,
              "male": 1,
              "female": 1,
              "total": 1,
              "expected": 2
            },
            {
              "location": "南多摩",
              "column": "川崎病",
              "row_index": 11,
              "male": 1,
              "female": 1,
              "total": 1,
              "expected": 2
            },
            {
              "location": "北多摩西部",
              "column": "流行性角結膜炎",
              "row_index": 12,
              "male": 1,
              "female": 1,
              "total": 1,
              "expected": 2
            },
            {
              "location": "北多摩南部",
              "column": "ヘルパンギーナ",
              "row_index": 13,
              "male": 1,
              "female": 1,
              "total": 1,
              "expected": 2
            }
          ]
        }
      }
    ]
  }
}