{
  "metadata_version": "1.1.0",
  "name": "normalized_sentinel_monthly_age_female_2010_04",
  "filename": "normalized_sentinel_monthly_age_female_2010_04.csv",
  "path": "processed/normalized_sentinel_monthly_age_female_2010_04.csv",
  "profile": "tokyo-idsc-processed",
  "data_type": "sentinel_monthly_age",
  "temporal": {
    "year": 2010,
    "period": 4,
    "period_type": "monthly"
  },
  "bytes": 1134,
  "lines": 18,
  "hash": {
    "algorithm": "sha256",
    "value": "acb674ef7a40d6ada75229c71610422e22c55e337d2d1b005b7fb027b835c77e"
  },
  "encoding": "utf-8",
  "created": "2025-12-18T07:32:56.560040+00:00",
  "modified": "2025-12-18T07:32:56.560040+00:00",
  "sources": [
    {
      "title": "sentinel_monthly_age_2010_04.csv",
      "path": "raw/sentinel_monthly_age_2010_04.csv"
    }
  ],
  "_process": {
    "source_name": "sentinel_monthly_age_2010_04",
    "source_hash": "b08152601fc63a9bde88a817079770f807f01e082f48611db5f35c7e94a4f4a9",
    "processing_time_seconds": 0.0006227493286132812,
    "gender": "female"
  }
}