{
  "metadata_version": "1.3.0",
  "name": "normalized_sentinel_monthly_medical_district_total_2011_11",
  "filename": "normalized_sentinel_monthly_medical_district_total_2011_11.csv",
  "path": "processed/normalized_sentinel_monthly_medical_district_total_2011_11.csv",
  "profile": "tokyo-idsc-processed",
  "data_type": "sentinel_monthly_medical_district",
  "temporal": {
    "year": 2011,
    "period": 11,
    "period_type": "monthly"
  },
  "bytes": 1277,
  "lines": 15,
  "hash": {
    "algorithm": "sha256",
    "value": "ec7981d659d906b950c05ceb4d1c815d9c1d1ceb79743a3f02fc6f50d0bbfa49"
  },
  "encoding": "utf-8",
  "created": "2026-10-09T03:18:30.120544+00:00",
  "modified": "2026-10-09T03:18:30.120544+00:00",
  "sources": [
    {
      "title": "sentinel_monthly_medical_district_2011_11.csv",
      "path": "raw/sentinel_monthly_medical_district_2011_11.csv"
    }
  ],
  "_process": {
    "source_name": "sentinel_monthly_medical_district_2011_11",
    "source_hash": "48d2ca422a4c7645b7218b0c3ec3365be7936d5c8b229ee3bfec6520fb5d6933",
    "processing_time_seconds": 0.00043845176696777344,
    "gender": "total"
  },
  "quality": {
    "validation_timestamp": "2026-10-09T03:18:30.120550+00:00",
    "validation_status": "completed",
    "issues": []
  }
}