{
  "metadata_version": "1.1.0",
  "name": "normalized_sentinel_weekly_age_male_2005_17",
  "filename": "normalized_sentinel_weekly_age_male_2005_17.csv",
  "path": "processed/normalized_sentinel_weekly_age_male_2005_17.csv",
  "profile": "tokyo-idsc-processed",
  "data_type": "sentinel_weekly_age",
  "temporal": {
    "year": 2005,
    "period": 17,
    "period_type": "weekly"
  },
  "bytes": 2708,
  "lines": 22,
  "hash": {
    "algorithm": "sha256",
    "value": "eb6fbcc62e6a2b731a5d35edf0f190292c2884107b3ba07f3d327d8c998e80e5"
  },
  "encoding": "utf-8",
  "created": "2025-12-18T07:33:00.861003+00:00",
  "modified": "2025-12-18T07:33:00.861003+00:00",
  "sources": [
    {
      "title": "sentinel_weekly_age_2005_17.csv",
      "path": "raw/sentinel_weekly_age_2005_17.csv"
    }
  ],
  "_process": {
    "source_name": "sentinel_weekly_age_2005_17",
    "source_hash": "7ca1ec928894331c96d1e12a022bb061acf65e66d3669d692be0bc54d7bb87ef",
    "processing_time_seconds": 0.0008122920989990234,
    "gender": "male"
  }
}