{
  "metadata_version": "1.2.0",
  "name": "sentinel_weekly_gender_2001_45",
  "filename": "sentinel_weekly_gender_2001_45.csv",
  "path": "raw/sentinel_weekly_gender_2001_45.csv",
  "profile": "tokyo-idsc-raw",
  "data_type": "sentinel_weekly_gender",
  "temporal": {
    "year": 2001,
    "period": 45,
    "period_type": "weekly"
  },
  "bytes": 1032,
  "lines": 30,
  "hash": {
    "algorithm": "sha256",
    "value": "257beafddbf50247ca9c1f11127f828c91ddb5711ef754a85aca00169b2b89fb"
  },
  "encoding": "shift_jis",
  "created": "2025-11-01T15:31:16.915244",
  "modified": "2025-11-01T15:31:16.915244",
  "sources": [],
  "verification": {
    "status": "verified",
    "verified_at": "2025-12-17T09:53:51.322093",
    "method": "automated",
    "checks": {
      "file_size": true,
      "encoding": true,
      "csv_format": true,
      "path_safety": true
    },
    "errors": [],
    "warnings": [
      "[csv_format] Inconsistent column count: {0, 1, 2, 5}"
    ]
  },
  "_fetch": {
    "fetch_time_seconds": 0.49858880043029785,
    "force_overwrite": false,
    "save_all_zero": false
  },
  "quality": {
    "validation_timestamp": "2025-12-20T18:25:52.307911+00:00",
    "validation_status": "skipped",
    "issues": []
  }
}