{
  "metadata_version": "1.3.0",
  "name": "normalized_sentinel_weekly_medical_district_male_2010_33",
  "filename": "normalized_sentinel_weekly_medical_district_male_2010_33.csv",
  "path": "processed/normalized_sentinel_weekly_medical_district_male_2010_33.csv",
  "profile": "tokyo-idsc-processed",
  "data_type": "sentinel_weekly_medical_district",
  "temporal": {
    "year": 2010,
    "period": 33,
    "period_type": "weekly"
  },
  "bytes": 2195,
  "lines": 15,
  "hash": {
    "algorithm": "sha256",
    "value": "1f9185eab1b1ec919be322311d1efbd48051bc67a48183c252f8951aab1b253a"
  },
  "encoding": "utf-8",
  "created": "2025-12-18T07:33:03.714406+00:00",
  "modified": "2026-10-09T03:31:30.224406+00:00",
  "sources": [
    {
      "title": "sentinel_weekly_medical_district_2010_33.csv",
      "path": "raw/sentinel_weekly_medical_district_2010_33.csv"
    }
  ],
  "_process": {
    "source_name": "sentinel_weekly_medical_district_2010_33",
    "source_hash": "306ce5cf9336726b89949f281f0587ab19548e6d66f7318c4f0162062ea3f005",
    "processing_time_seconds": 0.0006341934204101562,
    "gender": "male"
  },
  "quality": {
    "validation_timestamp": "2026-10-09T03:31:30.224417+00:00",
    "validation_status": "completed",
    "issues": [
      {
        "check_type": "gender_sum_consistency",
        "validation_status": "completed",
        "message": "Observed mismatch between (male + female) and reported total in 13 record(s)",
        "details": {
          "source_file": "sentinel_weekly_medical_district_2010_33.csv",
          "affected_count": 13,
          "truncated": true,
          "affected_locations": [
            {
              "location": "区中央部",
              "column": "RSウイルス感染症",
              "row_index": 3,
              "male": 2,
              "female": 2,
              "total": 2,
              "expected": 4
            },
            {
              "location": "区南部",
              "column": "Ａ群溶血性レンサ球菌咽頭炎",
              "row_index": 4,
              "male": 1,
              "female": 1,
              "total": 1,
              "expected": 2
            },
            {
              "location": "区西南部",
              "column": "急性出血性結膜炎",
              "row_index": 5,
              "male": 1,
              "female": 1,
              "total": 1,
              "expected": 2
            },
            {
              "location": "区西部",
              "column": "マイコプラズマ肺炎",
              "row_index": 6,
              "male": 1,
              "female": 1,
              "total": 1,
              "expected": 2
            },
            {
              "location": "区西北部",
              "column": "伝染性紅斑",
              "row_index": 7,
              "male": 1,
              "female": 1,
              "total": 1,
              "expected": 2
            },
            {
              "location": "区東北部",
              "column": "不明発しん症",
              "row_index": 8,
              "male": 3,
              "female": 3,
              "total": 3,
              "expected": 6
            },
            {
              "location": "区東部",
              "column": "伝染性紅斑",
              "row_index": 9,
              "male": 2,
              "female": 2,
              "total": 2,
              "expected": 4
            },
            {
              "location": "西多摩",
              "column": "伝染性紅斑",
              "row_index": 10,
              "male": 1,
              "female": 1,
              "total": 1,
              "expected": 2
            },
            {
              "location": "南多摩",
              "column": "インフルエンザ",
              "row_index": 11,
              "male": 3,
              "female": 3,
              "total": 3,
              "expected": 6
            },
            {
              "location": "北多摩西部",
              "column": "Ａ群溶血性レンサ球菌咽頭炎",
              "row_index": 12,
              "male": 1,
              "female": 1,
              "total": 1,
              "expected": 2
            }
          ]
        }
      }
    ]
  }
}