{
  "metadata_version": "1.3.0",
  "name": "normalized_sentinel_weekly_medical_district_male_2007_49",
  "filename": "normalized_sentinel_weekly_medical_district_male_2007_49.csv",
  "path": "processed/normalized_sentinel_weekly_medical_district_male_2007_49.csv",
  "profile": "tokyo-idsc-processed",
  "data_type": "sentinel_weekly_medical_district",
  "temporal": {
    "year": 2007,
    "period": 49,
    "period_type": "weekly"
  },
  "bytes": 2461,
  "lines": 15,
  "hash": {
    "algorithm": "sha256",
    "value": "6de633ab73129ae8aca3ed899869c94d808ebad9e11555c1f88570457c8cb409"
  },
  "encoding": "utf-8",
  "created": "2025-12-18T07:32:58.568401+00:00",
  "modified": "2026-10-09T03:18:30.930864+00:00",
  "sources": [
    {
      "title": "sentinel_weekly_medical_district_2007_49.csv",
      "path": "raw/sentinel_weekly_medical_district_2007_49.csv"
    }
  ],
  "_process": {
    "source_name": "sentinel_weekly_medical_district_2007_49",
    "source_hash": "7fd080a6725c5e51a1c485de6fbce062edb6a4548e9095061383293df1b95aaf",
    "processing_time_seconds": 0.0005447864532470703,
    "gender": "male"
  },
  "quality": {
    "validation_timestamp": "2026-10-09T03:18:30.930872+00:00",
    "validation_status": "completed",
    "issues": [
      {
        "check_type": "gender_sum_consistency",
        "validation_status": "completed",
        "message": "Observed mismatch between (male + female) and reported total in 12 record(s)",
        "details": {
          "source_file": "sentinel_weekly_medical_district_2007_49.csv",
          "affected_count": 12,
          "truncated": true,
          "affected_locations": [
            {
              "location": "区中央部",
              "column": "手足口病",
              "row_index": 3,
              "male": 1,
              "female": 1,
              "total": 1,
              "expected": 2
            },
            {
              "location": "区南部",
              "column": "手足口病",
              "row_index": 4,
              "male": 2,
              "female": 2,
              "total": 2,
              "expected": 4
            },
            {
              "location": "区西南部",
              "column": "伝染性紅斑",
              "row_index": 5,
              "male": 1,
              "female": 1,
              "total": 1,
              "expected": 2
            },
            {
              "location": "区西部",
              "column": "咽頭結膜熱",
              "row_index": 6,
              "male": 4,
              "female": 4,
              "total": 4,
              "expected": 8
            },
            {
              "location": "区西北部",
              "column": "流行性耳下腺炎",
              "row_index": 7,
              "male": 2,
              "female": 2,
              "total": 2,
              "expected": 4
            },
            {
              "location": "区東北部",
              "column": "手足口病",
              "row_index": 8,
              "male": 2,
              "female": 2,
              "total": 2,
              "expected": 4
            },
            {
              "location": "西多摩",
              "column": "流行性角結膜炎",
              "row_index": 10,
              "male": 1,
              "female": 1,
              "total": 1,
              "expected": 2
            },
            {
              "location": "南多摩",
              "column": "流行性耳下腺炎",
              "row_index": 11,
              "male": 2,
              "female": 2,
              "total": 2,
              "expected": 4
            },
            {
              "location": "北多摩西部",
              "column": "突発性発しん",
              "row_index": 12,
              "male": 2,
              "female": 2,
              "total": 2,
              "expected": 4
            },
            {
              "location": "北多摩南部",
              "column": "RSウイルス感染症",
              "row_index": 13,
              "male": 1,
              "female": 1,
              "total": 1,
              "expected": 2
            }
          ]
        }
      }
    ]
  }
}