{
  "metadata_version": "1.3.0",
  "name": "normalized_sentinel_weekly_medical_district_female_2024_43",
  "filename": "normalized_sentinel_weekly_medical_district_female_2024_43.csv",
  "path": "processed/normalized_sentinel_weekly_medical_district_female_2024_43.csv",
  "profile": "tokyo-idsc-processed",
  "data_type": "sentinel_weekly_medical_district",
  "temporal": {
    "year": 2024,
    "period": 43,
    "period_type": "weekly"
  },
  "bytes": 2549,
  "lines": 15,
  "hash": {
    "algorithm": "sha256",
    "value": "9f9016dafd6ce9799e64329925fa8ccaeeea105cac7c248b347f9dddd83df4e1"
  },
  "encoding": "utf-8",
  "created": "2025-12-18T07:32:59.502906+00:00",
  "modified": "2026-10-09T03:41:17.946241+00:00",
  "sources": [
    {
      "title": "sentinel_weekly_medical_district_2024_43.csv",
      "path": "raw/sentinel_weekly_medical_district_2024_43.csv"
    }
  ],
  "_process": {
    "source_name": "sentinel_weekly_medical_district_2024_43",
    "source_hash": "38bb26217bf40b4fbe5fae054d624544e1baf7400a2bd2e5262ccd809685877f",
    "processing_time_seconds": 0.0007700920104980469,
    "gender": "female"
  },
  "quality": {
    "validation_timestamp": "2026-10-09T03:41:17.946253+00:00",
    "validation_status": "completed",
    "issues": [
      {
        "check_type": "gender_sum_consistency",
        "validation_status": "completed",
        "message": "Observed mismatch between (male + female) and reported total in 12 record(s)",
        "details": {
          "source_file": "sentinel_weekly_medical_district_2024_43.csv",
          "affected_count": 12,
          "truncated": true,
          "affected_locations": [
            {
              "location": "区中央部",
              "column": "咽頭結膜熱",
              "row_index": 3,
              "male": 3,
              "female": 3,
              "total": 3,
              "expected": 6
            },
            {
              "location": "区南部",
              "column": "水痘",
              "row_index": 4,
              "male": 2,
              "female": 2,
              "total": 2,
              "expected": 4
            },
            {
              "location": "区西部",
              "column": "咽頭結膜熱",
              "row_index": 6,
              "male": 3,
              "female": 3,
              "total": 3,
              "expected": 6
            },
            {
              "location": "区西北部",
              "column": "不明発しん症",
              "row_index": 7,
              "male": 1,
              "female": 1,
              "total": 1,
              "expected": 2
            },
            {
              "location": "区東部",
              "column": "RSウイルス感染症",
              "row_index": 9,
              "male": 3,
              "female": 3,
              "total": 3,
              "expected": 6
            },
            {
              "location": "西多摩",
              "column": "Ａ群溶血性レンサ球菌咽頭炎",
              "row_index": 10,
              "male": 1,
              "female": 1,
              "total": 1,
              "expected": 2
            },
            {
              "location": "南多摩",
              "column": "流行性耳下腺炎",
              "row_index": 11,
              "male": 1,
              "female": 1,
              "total": 1,
              "expected": 2
            },
            {
              "location": "北多摩西部",
              "column": "流行性角結膜炎",
              "row_index": 12,
              "male": 1,
              "female": 1,
              "total": 1,
              "expected": 2
            },
            {
              "location": "北多摩南部",
              "column": "無菌性髄膜炎",
              "row_index": 13,
              "male": 1,
              "female": 1,
              "total": 1,
              "expected": 2
            },
            {
              "location": "北多摩北部",
              "column": "RSウイルス感染症",
              "row_index": 14,
              "male": 4,
              "female": 4,
              "total": 4,
              "expected": 8
            }
          ]
        }
      }
    ]
  }
}