{
  "metadata_version": "1.1.0",
  "name": "normalized_sentinel_monthly_gender_2020_08",
  "filename": "normalized_sentinel_monthly_gender_2020_08.csv",
  "path": "processed/normalized_sentinel_monthly_gender_2020_08.csv",
  "profile": "tokyo-idsc-processed",
  "data_type": "sentinel_monthly_gender",
  "temporal": {
    "year": 2020,
    "period": 8,
    "period_type": "monthly"
  },
  "bytes": 523,
  "lines": 10,
  "hash": {
    "algorithm": "sha256",
    "value": "1b48645a768b4e12882390273e5323cc6cc154a9d65aa3975f90bbd6dd290209"
  },
  "encoding": "utf-8",
  "created": "2025-12-18T07:33:01.168092+00:00",
  "modified": "2025-12-18T07:33:01.168092+00:00",
  "sources": [
    {
      "title": "sentinel_monthly_gender_2020_08.csv",
      "path": "raw/sentinel_monthly_gender_2020_08.csv"
    }
  ],
  "_process": {
    "source_name": "sentinel_monthly_gender_2020_08",
    "source_hash": "e5184d4558d332686da3964826596bc552b561864abafe34c7fe1c4c9541f5cb",
    "processing_time_seconds": 7.796287536621094e-05,
    "gender": null
  }
}