{
  "metadata_version": "1.3.0",
  "name": "normalized_sentinel_weekly_medical_district_male_2008_05",
  "filename": "normalized_sentinel_weekly_medical_district_male_2008_05.csv",
  "path": "processed/normalized_sentinel_weekly_medical_district_male_2008_05.csv",
  "profile": "tokyo-idsc-processed",
  "data_type": "sentinel_weekly_medical_district",
  "temporal": {
    "year": 2008,
    "period": 5,
    "period_type": "weekly"
  },
  "bytes": 2220,
  "lines": 15,
  "hash": {
    "algorithm": "sha256",
    "value": "061bf4ed45c44e90c816b974db60a27e75fe11dd79c115bdc25ba9b76b0fdc65"
  },
  "encoding": "utf-8",
  "created": "2025-12-18T07:33:02.769808+00:00",
  "modified": "2026-10-09T03:18:30.983743+00:00",
  "sources": [
    {
      "title": "sentinel_weekly_medical_district_2008_05.csv",
      "path": "raw/sentinel_weekly_medical_district_2008_05.csv"
    }
  ],
  "_process": {
    "source_name": "sentinel_weekly_medical_district_2008_05",
    "source_hash": "f0e451e2dd08513a8604a23c4aee1c040cb46296f21cbe0e26622b53730fb0e4",
    "processing_time_seconds": 0.0005164146423339844,
    "gender": "male"
  },
  "quality": {
    "validation_timestamp": "2026-10-09T03:18:30.983751+00:00",
    "validation_status": "completed",
    "issues": [
      {
        "check_type": "gender_sum_consistency",
        "validation_status": "completed",
        "message": "Observed mismatch between (male + female) and reported total in 13 record(s)",
        "details": {
          "source_file": "sentinel_weekly_medical_district_2008_05.csv",
          "affected_count": 13,
          "truncated": true,
          "affected_locations": [
            {
              "location": "区中央部",
              "column": "咽頭結膜熱",
              "row_index": 3,
              "male": 2,
              "female": 2,
              "total": 2,
              "expected": 4
            },
            {
              "location": "区南部",
              "column": "咽頭結膜熱",
              "row_index": 4,
              "male": 5,
              "female": 5,
              "total": 5,
              "expected": 10
            },
            {
              "location": "区西南部",
              "column": "RSウイルス感染症",
              "row_index": 5,
              "male": 1,
              "female": 1,
              "total": 1,
              "expected": 2
            },
            {
              "location": "区西部",
              "column": "RSウイルス感染症",
              "row_index": 6,
              "male": 3,
              "female": 3,
              "total": 3,
              "expected": 6
            },
            {
              "location": "区西北部",
              "column": "伝染性紅斑",
              "row_index": 7,
              "male": 1,
              "female": 1,
              "total": 1,
              "expected": 2
            },
            {
              "location": "区東北部",
              "column": "ヘルパンギーナ",
              "row_index": 8,
              "male": 1,
              "female": 1,
              "total": 1,
              "expected": 2
            },
            {
              "location": "区東部",
              "column": "伝染性紅斑",
              "row_index": 9,
              "male": 1,
              "female": 1,
              "total": 1,
              "expected": 2
            },
            {
              "location": "西多摩",
              "column": "咽頭結膜熱",
              "row_index": 10,
              "male": 1,
              "female": 1,
              "total": 1,
              "expected": 2
            },
            {
              "location": "南多摩",
              "column": "RSウイルス感染症",
              "row_index": 11,
              "male": 1,
              "female": 1,
              "total": 1,
              "expected": 2
            },
            {
              "location": "北多摩西部",
              "column": "水痘",
              "row_index": 12,
              "male": 1,
              "female": 1,
              "total": 1,
              "expected": 2
            }
          ]
        }
      }
    ]
  }
}