{
  "metadata_version": "1.2.0",
  "name": "sentinel_weekly_health_center_2008_18",
  "filename": "sentinel_weekly_health_center_2008_18.csv",
  "path": "raw/sentinel_weekly_health_center_2008_18.csv",
  "profile": "tokyo-idsc-raw",
  "data_type": "sentinel_weekly_health_center",
  "temporal": {
    "year": 2008,
    "period": 18,
    "period_type": "weekly"
  },
  "bytes": 12365,
  "lines": 123,
  "hash": {
    "algorithm": "sha256",
    "value": "ea163875e734e245c2c99e61e721d6c8feccf3592e54d02ad2763b7804f4fb79"
  },
  "encoding": "shift_jis",
  "created": "2025-11-01T16:45:07.466690",
  "modified": "2025-11-01T16:45:07.466690",
  "sources": [],
  "verification": {
    "status": "verified",
    "verified_at": "2025-12-17T09:53:52.034560",
    "method": "automated",
    "checks": {
      "file_size": true,
      "encoding": true,
      "csv_format": true,
      "path_safety": true
    },
    "errors": [],
    "warnings": [
      "[csv_format] Inconsistent column count: {0, 1, 2, 27}"
    ]
  },
  "_fetch": {
    "fetch_time_seconds": 0.498690128326416,
    "force_overwrite": false,
    "save_all_zero": false
  },
  "quality": {
    "validation_timestamp": "2025-12-20T18:25:52.942568+00:00",
    "validation_status": "skipped",
    "issues": []
  }
}