{
  "metadata_version": "1.1.0",
  "name": "normalized_sentinel_monthly_age_male_2015_08",
  "filename": "normalized_sentinel_monthly_age_male_2015_08.csv",
  "path": "processed/normalized_sentinel_monthly_age_male_2015_08.csv",
  "profile": "tokyo-idsc-processed",
  "data_type": "sentinel_monthly_age",
  "temporal": {
    "year": 2015,
    "period": 8,
    "period_type": "monthly"
  },
  "bytes": 1142,
  "lines": 18,
  "hash": {
    "algorithm": "sha256",
    "value": "dd59185431b5bbca74760d96fc34f179e8e2642874e294696962ed36fd7e17b7"
  },
  "encoding": "utf-8",
  "created": "2025-12-18T07:32:57.268758+00:00",
  "modified": "2025-12-18T07:32:57.268758+00:00",
  "sources": [
    {
      "title": "sentinel_monthly_age_2015_08.csv",
      "path": "raw/sentinel_monthly_age_2015_08.csv"
    }
  ],
  "_process": {
    "source_name": "sentinel_monthly_age_2015_08",
    "source_hash": "31ecc0b8211a7effe29966a628201196deed82d9749cf728c5342a2c41f8a08d",
    "processing_time_seconds": 0.0005810260772705078,
    "gender": "male"
  }
}