{
  "metadata_version": "1.3.0",
  "name": "normalized_sentinel_weekly_medical_district_male_2026_41",
  "filename": "normalized_sentinel_weekly_medical_district_male_2026_41.csv",
  "path": "processed/normalized_sentinel_weekly_medical_district_male_2026_41.csv",
  "profile": "tokyo-idsc-processed",
  "data_type": "sentinel_weekly_medical_district",
  "temporal": {
    "year": 2026,
    "period": 41,
    "period_type": "weekly"
  },
  "bytes": 2785,
  "lines": 15,
  "hash": {
    "algorithm": "sha256",
    "value": "80d2599d0a57db3289f7d5e9084995bb7cb4371c701c340b5a7b83516e75f376"
  },
  "encoding": "utf-8",
  "created": "2026-10-15T08:20:32.280373+00:00",
  "modified": "2026-10-15T08:20:32.280373+00:00",
  "sources": [
    {
      "title": "sentinel_weekly_medical_district_2026_41.csv",
      "path": "raw/sentinel_weekly_medical_district_2026_41.csv"
    }
  ],
  "_process": {
    "source_name": "sentinel_weekly_medical_district_2026_41",
    "source_hash": "642444af08af9e6b92a9a04d0649b5bae4ea95fc2585456c30417eec832ca945",
    "processing_time_seconds": 0.0008442401885986328,
    "gender": "male"
  },
  "quality": {
    "validation_timestamp": "2026-10-15T08:20:32.280383+00:00",
    "validation_status": "completed",
    "issues": [
      {
        "check_type": "gender_sum_consistency",
        "validation_status": "completed",
        "message": "Observed mismatch between (male + female) and reported total in 10 record(s)",
        "details": {
          "source_file": "sentinel_weekly_medical_district_2026_41.csv",
          "affected_count": 10,
          "truncated": false,
          "affected_locations": [
            {
              "location": "区中央部",
              "column": "咽頭結膜熱",
              "row_index": 3,
              "male": 1,
              "female": 1,
              "total": 1,
              "expected": 2
            },
            {
              "location": "区南部",
              "column": "咽頭結膜熱",
              "row_index": 4,
              "male": 2,
              "female": 2,
              "total": 2,
              "expected": 4
            },
            {
              "location": "区西南部",
              "column": "水痘",
              "row_index": 5,
              "male": 1,
              "female": 1,
              "total": 1,
              "expected": 2
            },
            {
              "location": "区西部",
              "column": "水痘",
              "row_index": 6,
              "male": 1,
              "female": 1,
              "total": 1,
              "expected": 2
            },
            {
              "location": "西多摩",
              "column": "突発性発しん",
              "row_index": 10,
              "male": 1,
              "female": 1,
              "total": 1,
              "expected": 2
            },
            {
              "location": "南多摩",
              "column": "流行性耳下腺炎",
              "row_index": 11,
              "male": 1,
              "female": 1,
              "total": 1,
              "expected": 2
            },
            {
              "location": "北多摩西部",
              "column": "突発性発しん",
              "row_index": 12,
              "male": 3,
              "female": 3,
              "total": 3,
              "expected": 6
            },
            {
              "location": "北多摩南部",
              "column": "伝染性紅斑",
              "row_index": 13,
              "male": 1,
              "female": 1,
              "total": 1,
              "expected": 2
            },
            {
              "location": "北多摩北部",
              "column": "突発性発しん",
              "row_index": 14,
              "male": 4,
              "female": 4,
              "total": 4,
              "expected": 8
            },
            {
              "location": "合計",
              "column": "咽頭結膜熱",
              "row_index": 16,
              "male": 11,
              "female": 20,
              "total": 28,
              "expected": 31
            }
          ]
        }
      }
    ]
  }
}