{
  "metadata_version": "1.3.0",
  "name": "normalized_sentinel_monthly_medical_district_female_2002_05",
  "filename": "normalized_sentinel_monthly_medical_district_female_2002_05.csv",
  "path": "processed/normalized_sentinel_monthly_medical_district_female_2002_05.csv",
  "profile": "tokyo-idsc-processed",
  "data_type": "sentinel_monthly_medical_district",
  "temporal": {
    "year": 2002,
    "period": 5,
    "period_type": "monthly"
  },
  "bytes": 1126,
  "lines": 15,
  "hash": {
    "algorithm": "sha256",
    "value": "e5a6112ddc1658f4c31c9ef2aa7c6419cd719ca91e70eaf8bb9eda92b38569d8"
  },
  "encoding": "utf-8",
  "created": "2025-12-18T07:33:03.787438+00:00",
  "modified": "2026-10-09T03:18:28.531257+00:00",
  "sources": [
    {
      "title": "sentinel_monthly_medical_district_2002_05.csv",
      "path": "raw/sentinel_monthly_medical_district_2002_05.csv"
    }
  ],
  "_process": {
    "source_name": "sentinel_monthly_medical_district_2002_05",
    "source_hash": "b7ee96c78ced61eb286e960167b11004d4a0b43dd6c12a13b96b0b08b208c81f",
    "processing_time_seconds": 0.0006794929504394531,
    "gender": "female"
  },
  "quality": {
    "validation_timestamp": "2026-10-09T03:18:28.531279+00:00",
    "validation_status": "completed",
    "issues": []
  }
}