{
  "metadata_version": "1.1.0",
  "name": "normalized_sentinel_weekly_health_center_total_2004_06",
  "filename": "normalized_sentinel_weekly_health_center_total_2004_06.csv",
  "path": "processed/normalized_sentinel_weekly_health_center_total_2004_06.csv",
  "profile": "tokyo-idsc-processed",
  "data_type": "sentinel_weekly_health_center",
  "temporal": {
    "year": 2004,
    "period": 6,
    "period_type": "weekly"
  },
  "bytes": 5516,
  "lines": 38,
  "hash": {
    "algorithm": "sha256",
    "value": "40de42bbde5915583f13c86dd23743cf88868d0deb5722d0aa438d909c721706"
  },
  "encoding": "utf-8",
  "created": "2025-12-18T07:33:02.604473+00:00",
  "modified": "2025-12-18T07:33:02.604473+00:00",
  "sources": [
    {
      "title": "sentinel_weekly_health_center_2004_06.csv",
      "path": "raw/sentinel_weekly_health_center_2004_06.csv"
    }
  ],
  "_process": {
    "source_name": "sentinel_weekly_health_center_2004_06",
    "source_hash": "4f98c215631b34b2d68c008c1a5a560dec693d804d52dd998c0a30a08e98c7e0",
    "processing_time_seconds": 0.0012063980102539062,
    "gender": "total"
  }
}